{
  "content": "# this is a h1 title\nAnd this is a paragraph\n- list item 1\n- list item 2",
  "format": "markdown",
  "title": "",
  "description": "",
  "previewImgURL": "",
  "slug": "",
  "alias": "",
  "conditionalRuleId": "",
  "sorting": "alphabetical",
  "hidden": false,
  "docId": "21-character__string0",
  "parentDocId": "21-character__string0"
}